{
 "schema": "claude-cut/prompter-map@1",
 "created": "2026-09-29T11:02:25Z",
 "inputs": {
  "director": {
   "path": "mcp-setup.director.json",
   "sha256": "9ac7159d116672adbce0c7f304440919d257fcff879afc3ca2c7e19307a3d256"
  }
 },
 "prompters": {
  "th": {
   "path": "th.prompter.md",
   "sha256": "dbe49980025c69995eb49f69607f0f0104c0cdd7e8141360821471299478dbb2",
   "sentences": [
    {
     "s": 1,
     "n": 1,
     "segment": "b01"
    },
    {
     "s": 2,
     "n": 2,
     "segment": "b01"
    },
    {
     "s": 3,
     "n": 3,
     "segment": "b02"
    },
    {
     "s": 4,
     "n": 4,
     "segment": "b02"
    },
    {
     "s": 5,
     "n": 5,
     "segment": "b02"
    },
    {
     "s": 6,
     "n": 7,
     "segment": "b02"
    },
    {
     "s": 7,
     "n": 8,
     "segment": "b03"
    },
    {
     "s": 8,
     "n": 9,
     "segment": "b03"
    },
    {
     "s": 9,
     "n": 10,
     "segment": "b03"
    },
    {
     "s": 10,
     "n": 11,
     "segment": "b03"
    },
    {
     "s": 11,
     "n": 12,
     "segment": "b04"
    },
    {
     "s": 12,
     "n": 13,
     "segment": "b04"
    },
    {
     "s": 13,
     "n": 19,
     "segment": "b06b"
    },
    {
     "s": 14,
     "n": 23,
     "segment": "b08"
    },
    {
     "s": 15,
     "n": 24,
     "segment": "b08"
    },
    {
     "s": 16,
     "n": 25,
     "segment": "b08"
    },
    {
     "s": 17,
     "n": 34,
     "segment": "b11b"
    },
    {
     "s": 18,
     "n": 35,
     "segment": "b12"
    },
    {
     "s": 19,
     "n": 36,
     "segment": "b12"
    },
    {
     "s": 20,
     "n": 37,
     "segment": "b12"
    },
    {
     "s": 21,
     "n": 38,
     "segment": "b13"
    },
    {
     "s": 22,
     "n": 39,
     "segment": "b13"
    },
    {
     "s": 23,
     "n": 40,
     "segment": "b13"
    },
    {
     "s": 24,
     "n": 41,
     "segment": "b14"
    },
    {
     "s": 25,
     "n": 42,
     "segment": "b14"
    },
    {
     "s": 26,
     "n": 43,
     "segment": "b14"
    },
    {
     "s": 27,
     "n": 44,
     "segment": "b15"
    },
    {
     "s": 28,
     "n": 45,
     "segment": "b15"
    },
    {
     "s": 29,
     "n": 46,
     "segment": "b15"
    },
    {
     "s": 30,
     "n": 47,
     "segment": "b16a"
    },
    {
     "s": 31,
     "n": 60,
     "segment": "b21"
    },
    {
     "s": 32,
     "n": 64,
     "segment": "b23b"
    },
    {
     "s": 33,
     "n": 65,
     "segment": "b24"
    },
    {
     "s": 34,
     "n": 71,
     "segment": "b27"
    },
    {
     "s": 35,
     "n": 72,
     "segment": "b27"
    },
    {
     "s": 36,
     "n": 73,
     "segment": "b27"
    },
    {
     "s": 37,
     "n": 82,
     "segment": "b31"
    },
    {
     "s": 38,
     "n": 87,
     "segment": "b35"
    },
    {
     "s": 39,
     "n": 88,
     "segment": "b35"
    },
    {
     "s": 40,
     "n": 89,
     "segment": "b36"
    },
    {
     "s": 41,
     "n": 90,
     "segment": "b36"
    },
    {
     "s": 42,
     "n": 91,
     "segment": "b36"
    },
    {
     "s": 43,
     "n": 92,
     "segment": "b36"
    },
    {
     "s": 44,
     "n": 93,
     "segment": "b36"
    },
    {
     "s": 45,
     "n": 94,
     "segment": "b36"
    },
    {
     "s": 46,
     "n": 95,
     "segment": "b37"
    },
    {
     "s": 47,
     "n": 96,
     "segment": "b37"
    },
    {
     "s": 48,
     "n": 97,
     "segment": "b37"
    },
    {
     "s": 49,
     "n": 100,
     "segment": "b39b"
    },
    {
     "s": 50,
     "n": 102,
     "segment": "b40"
    },
    {
     "s": 51,
     "n": 103,
     "segment": "b40"
    },
    {
     "s": 52,
     "n": 104,
     "segment": "b41"
    },
    {
     "s": 53,
     "n": 105,
     "segment": "b41"
    },
    {
     "s": 54,
     "n": 106,
     "segment": "b41"
    },
    {
     "s": 55,
     "n": 107,
     "segment": "b41"
    },
    {
     "s": 56,
     "n": 108,
     "segment": "b42"
    },
    {
     "s": 57,
     "n": 109,
     "segment": "b42"
    },
    {
     "s": 58,
     "n": 110,
     "segment": "b43"
    },
    {
     "s": 59,
     "n": 111,
     "segment": "b43"
    },
    {
     "s": 60,
     "n": 112,
     "segment": "b43"
    },
    {
     "s": 61,
     "n": 113,
     "segment": "b43"
    },
    {
     "s": 62,
     "n": 114,
     "segment": "b43"
    },
    {
     "s": 63,
     "n": 115,
     "segment": "b44"
    },
    {
     "s": 64,
     "n": 116,
     "segment": "b44"
    },
    {
     "s": 65,
     "n": 117,
     "segment": "b44"
    },
    {
     "s": 66,
     "n": 118,
     "segment": "b44"
    },
    {
     "s": 67,
     "n": 131,
     "segment": "b48"
    },
    {
     "s": 68,
     "n": 132,
     "segment": "b48"
    },
    {
     "s": 69,
     "n": 142,
     "segment": "b51b"
    },
    {
     "s": 70,
     "n": 143,
     "segment": "b52"
    },
    {
     "s": 71,
     "n": 144,
     "segment": "b52"
    },
    {
     "s": 72,
     "n": 145,
     "segment": "b53"
    },
    {
     "s": 73,
     "n": 146,
     "segment": "b53"
    },
    {
     "s": 74,
     "n": 147,
     "segment": "b53"
    },
    {
     "s": 75,
     "n": 155,
     "segment": "b56"
    },
    {
     "s": 76,
     "n": 156,
     "segment": "b56"
    },
    {
     "s": 77,
     "n": 162,
     "segment": "b58"
    },
    {
     "s": 78,
     "n": 163,
     "segment": "b58"
    },
    {
     "s": 79,
     "n": 164,
     "segment": "b58"
    },
    {
     "s": 80,
     "n": 165,
     "segment": "b58"
    },
    {
     "s": 81,
     "n": 166,
     "segment": "b59"
    },
    {
     "s": 82,
     "n": 167,
     "segment": "b59"
    }
   ],
   "untimed": [
    {
     "n": 6,
     "segment": "b02",
     "text": "Fine."
    },
    {
     "n": 101,
     "segment": "b40",
     "text": "Right."
    },
    {
     "n": 157,
     "segment": "b56",
     "text": "Sweet huh!"
    },
    {
     "n": 168,
     "segment": "b59",
     "text": "Happy building."
    }
   ]
  },
  "vo": {
   "path": "vo.prompter.md",
   "sha256": "d4ebf39946758b6ba9ba9eb20d971a66e79658d0fdc8513b0a03bb6aaa2cf3ef",
   "sentences": [
    {
     "s": 1,
     "n": 14,
     "segment": "b05"
    },
    {
     "s": 2,
     "n": 15,
     "segment": "b05"
    },
    {
     "s": 3,
     "n": 16,
     "segment": "b05"
    },
    {
     "s": 4,
     "n": 17,
     "segment": "b06a"
    },
    {
     "s": 5,
     "n": 18,
     "segment": "b06a"
    },
    {
     "s": 6,
     "n": 20,
     "segment": "b07"
    },
    {
     "s": 7,
     "n": 21,
     "segment": "b07"
    },
    {
     "s": 8,
     "n": 22,
     "segment": "b07"
    },
    {
     "s": 9,
     "n": 26,
     "segment": "b09"
    },
    {
     "s": 10,
     "n": 27,
     "segment": "b09"
    },
    {
     "s": 11,
     "n": 28,
     "segment": "b09"
    },
    {
     "s": 12,
     "n": 29,
     "segment": "b10"
    },
    {
     "s": 13,
     "n": 30,
     "segment": "b10"
    },
    {
     "s": 14,
     "n": 31,
     "segment": "b10"
    },
    {
     "s": 15,
     "n": 32,
     "segment": "b11a"
    },
    {
     "s": 16,
     "n": 33,
     "segment": "b11a"
    },
    {
     "s": 17,
     "n": 48,
     "segment": "b16b"
    },
    {
     "s": 18,
     "n": 49,
     "segment": "b17"
    },
    {
     "s": 19,
     "n": 50,
     "segment": "b18"
    },
    {
     "s": 20,
     "n": 51,
     "segment": "b18"
    },
    {
     "s": 21,
     "n": 52,
     "segment": "b18"
    },
    {
     "s": 22,
     "n": 53,
     "segment": "b18"
    },
    {
     "s": 23,
     "n": 54,
     "segment": "b19"
    },
    {
     "s": 24,
     "n": 55,
     "segment": "b19"
    },
    {
     "s": 25,
     "n": 56,
     "segment": "b19"
    },
    {
     "s": 26,
     "n": 57,
     "segment": "b20"
    },
    {
     "s": 27,
     "n": 58,
     "segment": "b20"
    },
    {
     "s": 28,
     "n": 59,
     "segment": "b20"
    },
    {
     "s": 29,
     "n": 61,
     "segment": "b22"
    },
    {
     "s": 30,
     "n": 62,
     "segment": "b23a"
    },
    {
     "s": 31,
     "n": 63,
     "segment": "b23a"
    },
    {
     "s": 32,
     "n": 66,
     "segment": "b25"
    },
    {
     "s": 33,
     "n": 67,
     "segment": "b25"
    },
    {
     "s": 34,
     "n": 68,
     "segment": "b25"
    },
    {
     "s": 35,
     "n": 69,
     "segment": "b26"
    },
    {
     "s": 36,
     "n": 70,
     "segment": "b26"
    },
    {
     "s": 37,
     "n": 74,
     "segment": "b28"
    },
    {
     "s": 38,
     "n": [
      75,
      76
     ],
     "segment": [
      "b28",
      "b29"
     ]
    },
    {
     "s": 39,
     "n": 77,
     "segment": "b29"
    },
    {
     "s": 40,
     "n": 79,
     "segment": "b30"
    },
    {
     "s": 41,
     "n": 80,
     "segment": "b30"
    },
    {
     "s": 42,
     "n": 83,
     "segment": "b32"
    },
    {
     "s": 43,
     "n": 84,
     "segment": "b33"
    },
    {
     "s": 44,
     "n": 85,
     "segment": "b33"
    },
    {
     "s": 45,
     "n": 86,
     "segment": "b34"
    },
    {
     "s": 46,
     "n": 98,
     "segment": "b38"
    },
    {
     "s": 47,
     "n": 99,
     "segment": "b39a"
    },
    {
     "s": 48,
     "n": 119,
     "segment": "b45"
    },
    {
     "s": 49,
     "n": 120,
     "segment": "b45"
    },
    {
     "s": 50,
     "n": 121,
     "segment": "b45"
    },
    {
     "s": 51,
     "n": 122,
     "segment": "b45"
    },
    {
     "s": 52,
     "n": 123,
     "segment": "b45"
    },
    {
     "s": 53,
     "n": 124,
     "segment": "b46"
    },
    {
     "s": 54,
     "n": 125,
     "segment": "b46"
    },
    {
     "s": 55,
     "n": 126,
     "segment": "b46"
    },
    {
     "s": 56,
     "n": 127,
     "segment": "b47"
    },
    {
     "s": 57,
     "n": 128,
     "segment": "b47"
    },
    {
     "s": 58,
     "n": 129,
     "segment": "b47"
    },
    {
     "s": 59,
     "n": 130,
     "segment": "b47"
    },
    {
     "s": 60,
     "n": 133,
     "segment": "b49"
    },
    {
     "s": 61,
     "n": 134,
     "segment": "b49"
    },
    {
     "s": 62,
     "n": 135,